{
  "record_type": "mms.problem",
  "problem_id": "01JH2M2J5C2N4QJ7Z0K9QW2X1P",
  "mms_version": "0.4.0",
  "rp_version": "0.4.0",
  "created_at": "2025-12-31T12:30:00Z",
  "domain": {
    "id": "medicine",
    "label": "Medizin",
    "subdomain": {
      "id": "infectious-diseases",
      "label": "Infektiologie"
    }
  },
  "title": {
    "text": "Influenza",
    "language": "de"
  },
  "summary": {
    "text": "Akute Virusinfektion der Atemwege, typischerweise saisonal auftretend.",
    "language": "de"
  },
  "terms": [
    { "text": "Influenza", "language": "de", "kind": "label" },
    { "text": "Grippe", "language": "de", "kind": "synonym" },
    { "text": "influenza", "language": "en", "kind": "label" },
    { "text": "flu", "language": "en", "kind": "synonym" }
  ],
  "links": {
    "related_to": ["01JH2M2H8P0S8Q9F2A7B1C3D4E"]
  },
  "quality": {
    "schema_valid": true
  }
}

